Name,City,Latitude,Longitude,Address,Rating,SchoolType
Louis Lake Intermediate School,Garden Grove,33.797352,-117.943985,92840,6,public
Jessie Hayden Elementary School,Westminster,33.74778,-117.975922,92655,6,public
Red Hill Elementary School,Tustin,33.756935,-117.792694,92705,6,public
Rice Canyon Elementary School,Lake Elsinore,33.697914,-117.401581,92530,6,public
Henry J. Kaiser High School,Fontana,34.051682,-117.492424,92337,6,public
Classical Academy,Escondido,33.0844,-117.055496,92025,6,charter
Crittenden Middle School,Mountain View,37.411633,-122.085472,94043,6,public
Monta Loma Elementary School,Mountain View,37.408939,-122.098534,94043,6,public
Mit Academy,Vallejo,38.150658,-122.24556,94589,6,charter
Barbara Spratling Middle School,Keyes,37.560417,-120.903496,95326,6,public
Liberty Elementary School,Kerman,36.725243,-120.079529,93630,6,public
Berkshire Elementary School,Bakersfield,35.289989,-119.045769,93313,6,public
Fair Oaks Ranch Community,Canyon Country,34.403343,-118.448166,91387,6,public
Three Rings Ranch Elementary School,Beaumont,33.93689,-116.994812,92223,6,public
Orange Elementary School,Norco,33.829754,-117.549301,92881,6,public
John Glenn Middle School Of International Studies,La Quinta,33.720798,-116.274895,92201,6,public
Canyon Lake Middle School,Lake Elsinore,33.659172,-117.254524,92532,6,public
Warm Springs Middle School,Murrieta,33.55138,-117.150398,92563,6,public
Colony High School,Ontario,34.018353,-117.568665,91761,6,public
Ted Porter Elementary School,Fontana,34.102566,-117.409737,92335,6,public
Einstein Academy,San Diego,32.720188,-117.129463,92102,6,charter
Nipomo High School,Arroyo Grande,35.049992,-120.486633,93444,6,public
Ingrid B. Lacy Middle School,Pacifica,37.637474,-122.49073,94044,6,public
SunRidge Charter School,Sebastopol,38.393112,-122.822937,95472,6,charter
El Diamante High School,Visalia,36.307323,-119.347542,93277,6,public
Magnolia Science Academy,Reseda,34.200722,-118.530518,91335,6,charter
Dr. J. Michael Mcgrath Elementary School,Valencia,34.376026,-118.513771,91321,6,public
Lincoln Elementary School,Ontario,34.068172,-117.636421,91764,6,public
Cypress Charter High School,Santa Cruz,36.965122,-121.984192,95062,6,charter
Intensive Learning Center,Bellflower,33.856995,-118.137527,90712,6,public
Leon H. Ollivier Middle School,Bakersfield,35.287876,-119.011055,93307,6,public
Raffaello Palla Elementary School,Bakersfield,35.304573,-119.009781,93307,6,public
Highland High School,Bakersfield,35.40107,-118.933212,93306,6,public
Ridgeview High School,Bakersfield,35.27747,-119.059814,93313,6,public
Midway Elementary School,Fellows,35.172607,-119.543922,93224,6,public
Irving L. Branch Elementary School,North Edwards,34.928551,-117.945717,93523,6,public
Norris Elementary School,Bakersfield,35.423855,-119.134499,93312,6,public
Norris Middle School,Bakersfield,35.42197,-119.109398,93312,6,public
Olive Drive Elementary School,Bakersfield,35.414761,-119.088852,93308,6,public
Buena Vista Elementary School,Bakersfield,35.295834,-119.129997,93311,6,public
Laurelglen Elementary School,Bakersfield,35.331573,-119.089149,93309,6,public
Roy W. Loudon Elementary School,Bakersfield,35.300945,-119.0466,93313,6,public
Sing Lum Elementary School,Bakersfield,35.313507,-119.103485,93311,6,public
Panama Elementary School,Bakersfield,35.268749,-119.056053,93313,6,public
Earl Warren Junior High School,Bakersfield,35.312504,-119.119461,93311,6,public
Bill L. Williams Elementary School,Bakersfield,35.302887,-119.064369,93313,6,public
Faller Elementary School,Ridgecrest,35.615181,-117.701172,93555,6,public
Gateway Elementary School,Ridgecrest,35.615005,-117.652802,93555,6,public
International Studies Learning Center At Legacy High School Complex,Los Angeles,33.941311,-118.179085,90280,6,public
Emery Park Elementary School,Alhambra,34.088062,-118.154648,91803,6,public
Marguerita Elementary School,Alhambra,34.074951,-118.138496,91803,6,public
Nova Academy,Santa Ana,33.74765,-117.873085,92701,6,charter
Accelerated Elementary Charter School,Los Angeles,34.011406,-118.273308,90037,6,charter
Mission Hills High School,San Marcos,33.14492,-117.141914,92069,6,public
Chavez Elementary School,Long Beach,33.769897,-118.200836,90802,6,public
Daniel J. Savage Middle School,Modesto,37.671665,-120.928207,95355,6,public
Whitmore Charter School Of Art & Technology,Ceres,37.585014,-120.93277,95307,6,charter
Tehachapi High School,Tehachapi,35.121445,-118.433014,93561,6,public
Ortega Elementary School,Pacifica,37.587887,-122.478348,94044,6,public
Foskett Ranch Elementary School,Lincoln,38.906975,-121.317345,95648,6,public
Six Rivers Charter High School,McKinleyville,40.87674,-124.089073,95521,6,charter
Turlock High School,Turlock,37.498299,-120.829491,95380,6,public
Wilmer Amina Carter High School,Rialto,34.148125,-117.403603,92377,6,public
George Kelly Elementary School,Tracy,37.724834,-121.46328,95377,6,public
Wasco High School,Wasco,35.595196,-119.347542,93280,6,public
Puc Lakeview Charter Academy,Burbank,34.280132,-118.381546,91342,6,charter
Artesia High School,Cerritos,33.843609,-118.074959,90715,6,public
Central Valley High School,Ceres,37.578918,-120.961098,95307,6,public
Susan La Vorgna Elementary School,Temecula,33.604084,-117.104599,92596,6,public
Orange County Educational Arts Academy,Santa Ana,33.752556,-117.869148,92701,6,charter
Segerstrom High School,Santa Ana,33.700302,-117.901283,92704,6,public
Manlio Silva Elementary School,Lodi,38.053749,-121.392395,95219,6,public
Haskell (Pliny Fisk) Middle School,Cerritos,33.846458,-118.08799,90703,6,public
Pioneer Valley High School,Santa Maria,34.956921,-120.401909,93454,6,public
Murray Middle School,Ridgecrest,35.637375,-117.672501,93555,6,public
Inderkum High School,Sacramento,38.658367,-121.517174,95835,6,public
Eje Elementary Academy Charter,El Cajon,32.784935,-116.970833,92020,6,charter
Richmond Elementary School,Ridgecrest,35.658772,-117.643532,93555,6,public
Adelante Dual Language Academy,San Jose,37.345097,-121.813202,95127,6,public
Pioneer Elementary School,Brentwood,37.955811,-121.735886,94513,6,public
Ross (Faye) Middle School,Cerritos,33.870369,-118.077721,90701,6,public
Lake Canyon Elementary School,Galt,38.285084,-121.30043,95632,6,public
Cawston Elementary School,Hemet,33.758915,-117.013992,92545,6,public
John H. Pitman High School,Turlock,37.530052,-120.877083,95382,6,public
Maywood Elementary School,Los Angeles,33.993305,-118.18399,90270,6,public
Vanguard Preparatory School,Apple Valley,34.487236,-117.163513,92308,6,public
Summit High School,Fontana,34.148331,-117.463715,92336,6,public
Renaissance Academy,San Jose,37.337811,-121.829651,95122,6,public
A. L. Conner Elementary School,Reedley,36.629177,-119.30838,93646,6,public
Foresthill High School,Auburn,39.017483,-120.834419,95631,6,public
South East High School,Los Angeles,33.945248,-118.223061,90280,6,public
River Valley High School,Yuba City,39.137951,-121.660042,95993,6,public
High Desert School,Acton,34.490311,-118.194839,93510,6,public
Wayne Ruble Middle School,Fontana,34.131783,-117.442123,92336,6,public
George Visual and Performing Arts Magnet and Middle School,Adelanto,34.580574,-117.432693,92301,6,public
Quartz Hill High School,Lancaster,34.658291,-118.238525,93536,6,public
High Tech Middle Media Arts School,San Diego,32.734604,-117.219749,92106,6,charter
Citrus Hill High School,Perris,33.856205,-117.32859,92570,6,public
Lasselle Elementary School,Perris,33.883884,-117.202888,92551,6,public
Summit Charter Academy,Porterville,36.063541,-119.062973,93257,6,charter
Thurgood Marshall Elementary School,Lynwood,33.933968,-118.203941,90262,6,public
Canyon Oaks Elementary School,Napa,38.167042,-122.243454,94503,6,public
Calavera Hills Middle School,Carlsbad,33.172318,-117.290298,92010,6,public
New Republic Elementary School,Salinas,36.713299,-121.626457,93906,6,public
Henry Dalton Elementary School,Azusa,34.13792,-117.902061,91702,6,public
James K. Polk Elementary School,Fresno,36.769032,-119.890923,93722,6,public
Towngate Elementary School,Moreno Valley,33.928574,-117.271599,92553,6,public
Charles H. Lee Elementary School,Azusa,34.130741,-117.89817,91702,6,public
Paramount Elementary School,Azusa,34.119457,-117.911987,91702,6,public
Wheatland Charter Academy,Wheatland,39.102669,-121.334427,95903,6,charter
Jackson Avenue Elementary School,Livermore,37.684822,-121.741272,94550,6,public
Galileo Academy 101,Victorville,34.496502,-117.314613,92395,6,public
Harvest Elementary School,Delano,35.774429,-119.227577,93215,6,public
Rio Vista Elementary School,Palm Springs,33.852654,-116.481209,92234,6,public
De Anza Elementary School,Baldwin Park,34.069588,-117.996323,91706,6,public
Sierra View Elementary School,Madera,36.987545,-119.879868,93636,6,public
Foster Elementary School,Baldwin Park,34.071545,-117.972084,91706,6,public
Sierra Vista High School,Baldwin Park,34.075237,-117.978989,91706,6,public
Walnut Elementary School,Baldwin Park,34.098137,-117.976379,91706,6,public
Don Julian Elementary School,La Puente,34.037941,-117.992371,91746,6,public
Edgewood Academy,La Puente,34.056232,-117.966469,91746,6,public
J. E. Van Wig Elementary School,La Puente,34.060535,-117.975258,91746,6,public
Albert Baxter Elementary School,Bellflower,33.897797,-118.140633,90706,6,public
Bellflower High School,Bellflower,33.89283,-118.114792,90706,6,public
Joe Michell K-8 School,Livermore,37.668854,-121.782654,94550,6,public
Esther Lindstrom Elementary School,Bellflower,33.861233,-118.110008,90713,6,public
Mayfair High School,Bellflower,33.864223,-118.116196,90713,6,public
Ramona Elementary School,Bellflower,33.883606,-118.135307,90706,6,public
Integrity Charter School,National City,32.676262,-117.10704,91950,6,charter
Rosemont High School,Sacramento,38.5438,-121.341415,95827,6,public
R. Paul Krey Elementary School,Brentwood,37.919052,-121.737755,94513,6,public
Central City Value School,Los Angeles,34.075089,-118.28862,90004,6,charter
Edward B. Cole Academy,Santa Ana,33.744572,-117.863861,92701,6,charter
Crenshaw Arts-Technology Charter High School,Los Angeles,34.009304,-118.329208,90008,6,charter
"Martin Luther King, Jr. Middle School",Hayward,37.635265,-122.091553,94545,6,public
Almond Tree Middle School,Delano,35.773453,-119.261993,93215,6,public
Oak Park Independent School,Oak Park,34.171551,-118.764778,91377,6,public
Fremont Elementary School,Delano,35.772186,-119.255005,93215,6,public
High Tech Middle School,San Diego,32.735241,-117.218048,92106,6,charter
Lemoore University Elementary Charter School,Lemoore,36.291859,-119.82814,93245,6,charter
KIPP Adelante Preparatory Academy,San Diego,32.715736,-117.161079,92101,6,charter
Monte Vista Elementary School,Murrieta,33.578388,-117.145432,92563,6,public
Pioneer High School,Woodland,38.660847,-121.739326,95776,6,public
Amelia Earhart Elementary School Of International Studies,La Quinta,33.720665,-116.27655,92201,6,public
Sundance Elementary School,Beaumont,33.933182,-116.953438,92223,6,public
St. Hope Public School 7,Sacramento,38.528347,-121.466911,95820,6,charter
Mckee Middle School,Bakersfield,35.273293,-119.00489,93307,6,public
Northlake Hills Elementary School,Valencia,34.511284,-118.628052,91384,6,public
Columbia Elementary School,Bakersfield,35.364491,-119.105263,93312,6,public
Dolores Huerta Elementary School,Lennox,33.942753,-118.357376,90304,6,public
Sacramento Charter High School,Sacramento,38.554401,-121.465233,95817,6,charter
Quailwood Elementary School,Bakersfield,35.358074,-119.084129,93309,6,public
Roseland Charter School,Santa Rosa,38.421913,-122.734688,95407,6,charter
Luther Burbank Middle School,Burbank,34.180927,-118.351379,91505,6,public
Thomas Edison Elementary School,Burbank,34.178146,-118.334114,91506,6,public
William Mckinley Elementary School,Burbank,34.166191,-118.311501,91506,6,public
Rancho Las Positas Elementary School,Livermore,37.687347,-121.796822,94551,6,public
El Roble Intermediate School,Claremont,34.100212,-117.730743,91711,6,public
Mountain View Elementary School,Claremont,34.105663,-117.730522,91711,6,public
Mayo Elementary School,Compton,33.902969,-118.213326,90221,6,public
Cedargrove Elementary School,Covina,34.101231,-117.86496,91724,6,public
Royal Oak Middle School,Covina,34.08379,-117.863869,91724,6,public
Las Palmas Middle School,Covina,34.090607,-117.917946,91722,6,public
Manzanita Elementary School,Covina,34.089046,-117.939911,91722,6,public
Rowland Avenue Elementary School,Covina,34.080204,-117.917282,91790,6,public
Linwood E. Howe Elementary School,Culver City,34.021992,-118.392166,90232,6,public
La Ballona Elementary School,Culver City,34.013447,-118.410568,90232,6,public
Alameda Elementary School,Downey,33.925655,-118.134911,90242,6,public
Doty Middle School,Downey,33.942566,-118.112244,90241,6,public
Imperial Elementary School,Downey,33.92289,-118.147743,90242,6,public
West Middle School,Downey,33.938908,-118.156181,90242,6,public
Williams Elementary School,Downey,33.943878,-118.148476,90241,6,public
Duarte High School,Duarte,34.136501,-117.970619,91010,6,public
Nord Country School,Chico,39.780701,-121.954597,95973,6,charter
Tiefort View Intermediate School,Yermo,35.253468,-116.694275,92310,6,public
Barrett Ranch Elementary School,Roseville,38.708744,-121.35051,95843,6,public
Railway Elementary School,Perris,33.760044,-117.234909,92570,6,public
Triple Crown Elementary School,Perris,33.816277,-117.215279,92571,6,public
Heron School,Sacramento,38.667313,-121.513138,95835,6,public
Chaparral Elementary School,Chino,33.974865,-117.699448,91709,6,public
El Rancho High School,Pico Rivera,33.985081,-118.089592,90660,6,public
Cottonwood Creek Elementary School,Visalia,36.292183,-119.324471,93277,6,public
Don Callejon School,Santa Clara,37.3983,-121.946556,95054,6,public
Wilshire Park Elementary School,Los Angeles,34.060978,-118.316544,90010,6,public
Ronald Reagan Elementary School,La Quinta,33.759266,-116.31662,92211,6,public
Animo Jackie Robinson High School,Los Angeles,34.017273,-118.27536,90007,6,charter
North Ranchito Elementary School,Pico Rivera,34.006432,-118.083511,90660,6,public
Rivergold Elementary School,Oakhurst,37.20792,-119.781487,93614,6,public
Fred T. Korematsu Elementary School At Mace Ranch,Davis,38.558567,-121.709213,95618,6,public
La Rosa Elementary School,Ceres,37.592297,-120.926521,95307,6,public
Bright Star Secondary Charter Academy,Los Angeles,33.930019,-118.30732,90047,6,charter
Charles H. Kim Elementary School,Los Angeles,34.070267,-118.308266,90004,6,public
Richmond College Preparatory School,Richmond,37.928509,-122.358566,94804,6,charter
Aspire Ollin University Preparatory Academy,Huntington Park,33.989975,-118.226395,90255,6,charter
Sitting Bull Academy,Apple Valley,34.485203,-117.236313,92308,6,public
Valencia Elementary School,Pico Rivera,33.988575,-118.086983,90660,6,public
Judson & Brown Elementary School,Redlands,34.074207,-117.154922,92374,6,public
Monterey Bay Charter School,Pacific Grove,36.604912,-121.931923,93950,6,charter
Gidley Elementary School,El Monte,34.091213,-118.043289,91731,6,public
Legore Elementary School,El Monte,34.081341,-118.029175,91731,6,public
Rio Vista Elementary School,El Monte,34.083591,-118.040573,91731,6,public
Wright Elementary School,El Monte,34.085403,-118.02253,91732,6,public
El Monte High School,El Monte,34.064838,-118.032883,91731,6,public
Evergreen Elementary School,Whittier,33.96365,-118.042191,90602,6,public
Hillview Middle School,Whittier,33.934212,-118.006508,90604,6,public
La Colima Elementary School,Whittier,33.929314,-118.020439,90604,6,public
Laurel Elementary School,Whittier,33.955929,-118.035454,90605,6,public
Mulberry Elementary School,Whittier,33.945553,-118.030449,90604,6,public
Ronald W. Reagan Elementary School,Kingsburg,36.511341,-119.570984,93631,6,charter
Orchard Dale Elementary School,Whittier,33.936413,-118.007263,90604,6,public
Discovery Charter Preparatory No. 2,Sylmar,34.319069,-118.425171,91342,6,charter
Scott Avenue Elementary School,Whittier,33.92704,-118.000748,90604,6,public
Yuba River Charter School,Grass Valley,39.226364,-121.082787,95945,6,charter
Nevada City School Of The Arts,Nevada City,39.252693,-121.134033,95959,6,charter
Rosa Parks Elementary School,Norco,33.964817,-117.585533,92880,6,public
Core Butte Charter School,Chico,39.754051,-121.85099,95926,6,charter
Dewey Avenue Elementary School,Rosemead,34.077904,-118.093178,91776,6,public
Edward C. Merlo Institute Of Environmental Studies,Stockton,37.935394,-121.263039,95206,6,public
Mission Valley Elementary School,Tulare,36.233616,-119.321632,93274,6,public
Magnolia Science Academy 2,Van Nuys,34.187103,-118.506943,91406,6,charter
Impact Academy of Arts and Technology,Hayward,37.630341,-122.102318,94545,6,charter
Aveson School Of Leaders,Altadena,34.192024,-118.111603,91001,6,charter
Garvey (Richard) Intermediate School,Rosemead,34.061768,-118.102943,91770,6,public
Rolling Hills Elementary School,Fairfield,38.290527,-122.041862,94534,6,public
Riverbank Language Academy,Riverbank,37.734676,-120.953705,95367,6,charter
Rice (Eldridge) Elementary School,Rosemead,34.052715,-118.086754,91770,6,public
Sanchez (George I.) Elementary School,Rosemead,34.058746,-118.083595,91770,6,public
Making Waves Academy,Richmond,37.988598,-122.332237,94806,6,charter
Theodore Roosevelt Middle School,Glendale,34.134212,-118.252434,91205,6,public
Woodrow Wilson Middle School,Glendale,34.156139,-118.238075,91206,6,public
Bixby Elementary School,City of Industry,33.997063,-117.947693,91745,6,public
California Elementary School,City of Industry,34.044544,-117.956848,91744,6,public
Del Valle Elementary School,City of Industry,34.03273,-117.944077,91744,6,public
Fairgrove Academy,City of Industry,34.040302,-117.945526,91744,6,public
La Puente High School,City of Industry,34.025551,-117.955231,91744,6,public
Los Altos High School,City of Industry,34.007656,-117.975761,91745,6,public
Newton Middle School,City of Industry,33.997261,-117.973457,91745,6,public
Orange Grove Middle School,City of Industry,34.011189,-117.995552,91745,6,public
Hawthorne Middle School,Hawthorne,33.914658,-118.350945,90250,6,public
Washington School,Hawthorne,33.915771,-118.351448,90250,6,public
Bud Carson Middle School,Hawthorne,33.906673,-118.334145,90250,6,public
Hughes-Elizabeth Lakes,Lake Hughes,34.672169,-118.424706,93532,6,public
Edna Brewer Middle School,Oakland,37.803707,-122.229362,94610,6,public
Ambler Avenue Elementary School,Los Angeles,33.878216,-118.270729,90746,6,public
Baldwin Hills Elementary School,Los Angeles,34.021439,-118.35083,90016,6,public
Luther Burbank Middle School,Los Angeles,34.119728,-118.183334,90042,6,public
Calahan Street Elementary,Los Angeles,34.237499,-118.541092,91324,6,charter
Calvert Charter For Enriched Studies,Los Angeles,34.181805,-118.566086,91367,6,charter
Canterbury Avenue Elementary School,Los Angeles,34.23291,-118.429199,91331,6,public
Castelar Street Elementary School,Los Angeles,34.063992,-118.23996,90012,6,public
Cheremoya Avenue Elementary School,Los Angeles,34.105652,-118.320671,90028,6,public
City Terrace Elementary School,Los Angeles,34.056786,-118.171921,90063,6,public
Dahlia Heights Elementary School,Los Angeles,34.138538,-118.199158,90041,6,public
Lankershim Elementary School,Los Angeles,34.165932,-118.376595,91601,6,public
Latona Avenue Elementary School,Los Angeles,34.0919,-118.202629,90031,6,public
Lorne Street Elementary School,Los Angeles,34.216705,-118.513573,91325,6,public
Marianna Avenue Elementary School,Los Angeles,34.03574,-118.17514,90063,6,public
Marvin Elementary School,Los Angeles,34.035419,-118.364273,90016,6,public
Robert A. Millikan Middle School,Los Angeles,34.162769,-118.427765,91423,6,charter
John B. Monlux Elementary School,Los Angeles,34.181072,-118.409988,91606,6,public
Montague Charter Academy,Pacoima,34.24448,-118.415024,91331,6,charter
Montara Avenue Elementary School,Los Angeles,33.943901,-118.217789,90280,6,public
Multnomah Street Elementary School,Los Angeles,34.068604,-118.193314,90032,6,public
Nestle Avenue Charter School,Los Angeles,34.161945,-118.530609,91356,6,charter
Nueva Vista Elementary School,Los Angeles,33.980911,-118.18824,90201,6,public
O'melveny Elementary School,Los Angeles,34.275085,-118.444435,91340,6,public
One Hundred Twenty-Second Street Elementary School,Los Angeles,33.92207,-118.267418,90061,6,public
John H. Francis Polytechnic,Los Angeles,34.223907,-118.403961,91352,6,public
Pomelo Community Charter School,Los Angeles,34.209473,-118.64296,91304,6,charter
Gaspar De Portola Middle School,Los Angeles,34.167419,-118.542519,91356,6,public
Walter Reed Middle School,Los Angeles,34.152943,-118.386078,91602,6,public
Richland Avenue Elementary School,Los Angeles,34.02837,-118.440285,90064,6,public
Riverside Drive Charter Elementary School,Los Angeles,34.158298,-118.417641,91423,6,charter
Rockdale Visual & Performing Arts Magnet,Los Angeles,34.13335,-118.194328,90041,6,public
South Gate Senior High School,Los Angeles,33.95607,-118.20932,90280,6,public
San Pascual Elementary Science Technology Engineering Arts And Mathematics (STEAM) Magnet ,Los Angeles,34.118813,-118.17215,90042,6,public
San Pedro Senior High School,Los Angeles,33.729988,-118.299385,90731,6,public
Short Avenue Elementary School,Los Angeles,33.990086,-118.431961,90066,6,public
Mary Ann Sanders Elementary School,Modesto,37.682686,-120.926765,95355,6,public
Temple (Roger W.) Intermediate School,Rosemead,34.058746,-118.083595,91770,6,public
Mission Oak High School,Tulare,36.197132,-119.296623,93274,6,public
Willard (Frances E.) Elementary School,Rosemead,34.065914,-118.083145,91770,6,public
Peyton Elementary & Middle Schools,Stockton,38.000557,-121.274193,95212,6,public
Delta Elementary Charter School,Clarksburg,38.416737,-121.527443,95612,6,charter
John F. Kennedy Elementary School,Newark,37.552475,-122.042412,94560,6,public
Earl Warren Elementary School,Lake Elsinore,33.696632,-117.317162,92532,6,public
Patriot High School,Jurupa Valley,34.008591,-117.450714,92509,6,public
Aspire Port City Academy,Stockton,37.975735,-121.280296,95205,6,charter
Mossdale Elementary School,Manteca,37.801338,-121.306175,95330,6,public
Dooley Elementary School,Long Beach,33.847301,-118.195366,90805,6,public
Crossroads Elementary School,Modesto,37.72179,-120.945595,95367,6,public
Alliance Jack H. Skirball Middle School,Los Angeles,33.930458,-118.264954,90059,6,charter
Voices College-Bound Language Academy,San Jose,37.28474,-121.821808,95111,6,charter
Winfield Elementary School,Winton,37.388668,-120.604866,95388,6,public
Health Sciences High School,San Diego,32.749744,-117.110474,92105,6,charter
Cerritos Elementary School,Glendale,34.12476,-118.253944,91205,6,public
Beech Avenue Elementary School,Fontana,34.086349,-117.471924,92335,6,public
Thomas Edison Elementary School,Glendale,34.140484,-118.26461,91204,6,public
Birch Grove Intermediate,Newark,37.535004,-122.022301,94560,6,public
Glendale High School,Glendale,34.145844,-118.232422,91205,6,public
Glenoaks Elementary School,Glendale,34.151604,-118.221954,91206,6,public
John Marshall Elementary School,Glendale,34.146763,-118.239006,91205,6,public
John Muir Elementary School,Glendale,34.135624,-118.239098,91205,6,public
Sierra Vista Elementary School,Los Angeles,34.096035,-118.159378,90032,6,public
Sunland Elementary School,Los Angeles,34.262775,-118.314743,91040,6,public
Hazel Strauch Elementary School,North Highlands,38.624233,-121.48111,95833,6,public
Dry Creek Elementary School,North Highlands,38.679501,-121.436775,95673,6,public
Pioneer Elementary School,North Highlands,38.673435,-121.34269,95841,6,public
Sierra View Elementary School,North Highlands,38.699013,-121.378868,95660,6,public
Ridgepoint Elementary School,North Highlands,38.700363,-121.356232,95842,6,public
Sylmar Senior High School,Los Angeles,34.307377,-118.442192,91342,6,charter
Thirty-Second Street Usc Performing Arts,Los Angeles,34.024338,-118.282799,90007,6,public
Towne Avenue Elementary School,Los Angeles,33.85833,-118.267418,90746,6,public
Tulsa Street Elementary School,Los Angeles,34.269009,-118.493156,91344,6,public
University Senior High School Charter,Los Angeles,34.046169,-118.460144,90025,6,charter
Van Deene Avenue Elementary School,Los Angeles,33.838661,-118.288429,90502,6,public
Van Ness Avenue Elementary School,Los Angeles,34.080811,-118.316078,90004,6,public
Van Nuys Senior High School,Los Angeles,34.189091,-118.45507,91411,6,public
Vaughn Next Century Learning Center,San Fernando,34.280479,-118.422592,91340,6,charter
Venice Senior High School,Los Angeles,33.997078,-118.445702,90066,6,public
Verdugo Hills Senior High School,Los Angeles,34.261093,-118.298454,91042,6,public
Vernon City Elementary School,Los Angeles,34.003483,-118.231285,90058,6,public
Weaverville Elementary School,Weaverville,40.732735,-122.93644,96093,6,public
Community Outreach Academy,McClellan,38.669811,-121.38488,95652,6,charter
Futures High School,Sacramento,38.651001,-121.442787,95838,6,charter
Creative Connections Arts Academy,North Highlands,38.700603,-121.370041,95660,6,charter
Lathrop High School,Manteca,37.826759,-121.30394,95330,6,public
Independence High School,Bakersfield,35.283413,-119.111443,93311,6,public
Nancy R. Kordyak Elementary School,Rialto,34.171303,-117.434929,92336,6,public
Stockton Collegiate International Elementary School,Stockton,37.954369,-121.286797,95202,6,charter
Valley Charter Elementary School,North Hills,34.234711,-118.492149,91343,6,charter
Ararat Charter School,Van Nuys,34.189968,-118.447014,91401,6,charter
Cedarlane Academy,City of Industry,33.999104,-117.951241,91745,6,public
Birney Elementary School,Long Beach,33.811382,-118.200714,90806,6,public
