Name,City,Latitude,Longitude,Address,Rating,SchoolType
"Lennox Mathematics, Science And Technology Academy",Lennox,33.93531,-118.351944,90304,9,charter
Temescal Valley Elementary School,Norco,33.786343,-117.498001,92883,9,public
Hidden Hills Elementary School,Danville,37.764523,-121.893036,94582,9,public
Windemere Ranch Middle School,Danville,37.75172,-121.907127,94582,9,public
Solana Pacific Elementary School,Solana Beach,32.951542,-117.231277,92130,9,public
Lakeview Elementary School,Rescue,38.698559,-121.09565,95762,9,public
James S. Fugman Elementary School,Clovis,36.892902,-119.757126,93730,9,public
Carmenita Middle School,Cerritos,33.881031,-118.045372,90703,9,public
Cerritos Elementary School,Cerritos,33.864704,-118.041275,90703,9,public
Heritage High School,Brentwood,37.921856,-121.755722,94513,9,public
Kearny Digital Media & Design School,San Diego,32.800175,-117.160545,92111,9,public
Salt Creek Elementary School,Chula Vista,32.647465,-116.94854,91914,9,public
Orthopaedic Hospital,Los Angeles,34.028843,-118.27121,90007,9,public
Leal (Frank C.) Elementary School,Cerritos,33.860954,-118.056274,90703,9,public
Woods (Harold L.) Elementary School,Clovis,36.860935,-119.702919,93619,9,public
Bullis Charter School,San Jose,37.396835,-122.116463,94022,9,charter
Rancho Pico Junior High School,Santa Clarita,34.401142,-118.592468,91381,9,public
Park View Elementary School,Ripon,37.759949,-121.131622,95366,9,public
Mark West Charter School,Santa Rosa,38.502514,-122.759422,95403,9,charter
Stone Ranch Elementary School,San Diego,33.0051,-117.116554,92127,9,public
Robert C. Fisler Elementary School,Fullerton,33.884922,-117.962219,92833,9,public
Academy Of The Redwoods,Fortuna,40.698433,-124.195374,95501,9,public
Mark Keppel High School,Alhambra,34.07069,-118.111534,91801,9,public
Whitney High School,Rocklin,38.835178,-121.287819,95765,9,public
Arcadia High School,Arcadia,34.129818,-118.038368,91007,9,public
Pacific Rim Elementary School,Carlsbad,33.110909,-117.305359,92011,9,public
Campolindo High School,Lafayette,37.866898,-122.127052,94556,10,public
Miramonte High School,Lafayette,37.841278,-122.14827,94563,10,public
Willma Cavitt Junior High School,Granite Bay,38.738171,-121.167458,95746,10,public
Greenhills Elementary School,Granite Bay,38.74995,-121.216003,95746,10,public
Oakhills Elementary School,Granite Bay,38.731045,-121.206482,95746,10,public
Granite Bay High School,Roseville,38.731174,-121.210876,95746,10,public
Burton Valley Elementary School,Lafayette,37.86195,-122.09333,94549,10,public
Carleton P. Lightfoot Elementary School,Etiwanda,34.127613,-117.5504,91701,10,public
Hillside Elementary School,San Bernardino,34.174023,-117.290619,92407,10,public
Richardson PREP HI Middle School,San Bernardino,34.092598,-117.306648,92410,10,public
Monte Vista High School,Danville,37.843845,-121.98175,94526,10,public
Lynbrook High School,Sunnyvale,37.30117,-122.005333,95129,10,public
Monta Vista High School,Sunnyvale,37.314838,-122.056664,95014,10,public
San Ramon Valley High School,Danville,37.825649,-122.006523,94526,10,public
Soar High (Students on Academic Rise) School,Lancaster,34.67617,-118.185371,93536,10,public
William & Marian Ghidotti High School,Grass Valley,39.235832,-121.047508,95945,10,public
El Segundo High School,El Segundo,33.924847,-118.415215,90245,10,public
Dougherty Valley High School,Danville,37.769375,-121.901619,94582,10,public
University High School,Fresno,36.81028,-119.744286,93740,10,charter
Granite Ridge Intermediate School,Clovis,36.889668,-119.732727,93730,10,public
Clovis North High School,Clovis,36.889668,-119.732727,93730,10,public
Dr. T. J. Owens Gilroy Early College Academy,Gilroy,36.973255,-121.568558,95020,10,public
Anderson W. Clark Magnet High School,Glendale,34.237286,-118.25399,91214,10,public
Valley View Elementary School,Glendale,34.239254,-118.250069,91214,10,public
Hermosa View Elementary School,Hermosa Beach,33.869045,-118.390549,90254,10,public
Balboa Gifted/High Ability Magnet Elementary School,Los Angeles,34.248325,-118.502945,91325,10,public
Downtown Business High School,Los Angeles,34.063046,-118.250412,90012,10,public
Thomas S. Hart Middle School,Pleasanton,37.685783,-121.896904,94588,9,public
Diablo Vista Middle School,Danville,37.798965,-121.897751,94506,9,public
Century Elementary School,Clovis,36.84761,-119.692421,93611,9,public
Quail Lake Environmental Charter School,Sanger,36.794693,-119.598839,93619,9,charter
Sanger Academy Charter,Sanger,36.701729,-119.567833,93657,9,charter
Ridgecrest Intermediate School,Palos Verdes Estates,33.766495,-118.378586,90275,9,public
Newport Coast Elementary School,Costa Mesa,33.605648,-117.825722,92657,9,public
H. Clarke Powers Elementary School,Loomis,38.831001,-121.202888,95650,9,public
Granite Oaks Middle School,Rocklin,38.821262,-121.251701,95765,9,public
Valley View Elementary School,Rocklin,38.814407,-121.24102,95765,9,public
Martin Luther King Jr. High School,Riverside,33.883812,-117.334442,92508,9,public
Abby Reinke Elementary School,Temecula,33.491848,-117.087372,92592,9,public
Cole Canyon Elementary School,Murrieta,33.575138,-117.246811,92562,9,public
Sage Canyon School,San Diego,32.92606,-117.203812,92130,9,public
Georgina P. Blach Junior High School,Los Altos,37.363956,-122.082855,94024,10,public
Los Gatos High School,Los Gatos,37.222404,-121.976562,95030,10,public
Saratoga High School,Los Gatos,37.266972,-122.031403,95070,10,public
Parkview Elementary School,Chula Vista,32.613731,-117.031197,91911,10,public
Coronado High School,Coronado,32.691898,-117.178352,92118,10,public
Helix High School,El Cajon,32.755905,-117.03981,91941,10,charter
Middle College High School,Richmond,37.968891,-122.340088,94806,10,public
R. Roger Rowe Elementary School,Rancho Santa Fe,33.021561,-117.20681,92067,10,public
Bird Rock Elementary School,San Diego,32.810806,-117.264153,92037,10,public
Hearst Elementary School,San Diego,32.783699,-117.064262,92120,10,public
Ocean Beach Elementary School,San Diego,32.745098,-117.246925,92107,10,public
Naples Elementary School,Long Beach,33.755249,-118.127495,90803,10,public
Piedmont High School,Piedmont,37.823254,-122.23233,94611,10,public
Montemalaga Elementary School,Palos Verdes Estates,33.790321,-118.395119,90274,10,public
Palos Verdes Peninsula High School,Palos Verdes Estates,33.778324,-118.373299,90274,10,public
Rancho Vista Elementary School,Palos Verdes Estates,33.787048,-118.356155,90274,10,public
San Marino High School,San Marino,34.125328,-118.098877,91108,10,public
Diamond Bar High School,Walnut,33.981213,-117.839203,91765,10,public
Maple Hill Elementary School,Walnut,33.996696,-117.824821,91765,10,public
Walnut High School,Walnut,34.022514,-117.849503,91789,10,public
Saugus High School,Santa Clarita,34.442738,-118.518707,91350,10,public
KIPP Iluminar Academy,Los Angeles,34.040291,-118.161385,90022,10,charter
Eunice Sato Academy Of Math & Science,Long Beach,33.780125,-118.105247,90815,10,public
Elevate Elementary,San Diego,32.786289,-117.144341,92123,10,charter
Pacific Trails Middle,Encinitas,32.958225,-117.186424,92130,10,public
Petaluma Accelerated Charter,Petaluma,38.244114,-122.633751,94952,10,charter
KIPP Raices Academy,Los Angeles,34.023006,-118.156219,90022,10,charter
Del Norte High School,San Diego,33.014809,-117.122063,92127,10,public
Mission Vista High School,Vista,33.256004,-117.264168,92057,10,public
Stockton Unified Early College Academy,Stockton,37.966946,-121.289459,95202,10,charter
University Preparatory High School,Visalia,36.322945,-119.314552,93277,10,charter
Yorba Linda High School,Placentia,33.898556,-117.789101,92886,10,public
Da Vinci Science School,El Segundo,33.917774,-118.383987,90245,10,charter
La Canada High School,La Canada,34.193062,-118.179131,91011,10,public
Western Center Academy,Hemet,33.705467,-116.992287,92545,10,charter
Gant Elementary School,Long Beach,33.790131,-118.118988,90815,10,public
Kettering Elementary School,Long Beach,33.772846,-118.105972,90803,10,public
California Academy Of Mathematics And Science,Long Beach,33.863968,-118.257004,90747,10,public
Creekside Elementary School,San Diego,32.944256,-117.07637,92128,9,public
Aviara Oaks Middle School,Carlsbad,33.103992,-117.277161,92011,9,public
Elkhorn School,Lodi,38.06916,-121.333374,95209,9,public
Charter School Of Morgan Hill,Morgan Hill,37.198555,-121.720718,95037,9,charter
Austin Creek Elementary School,Santa Rosa,38.465313,-122.637573,95409,9,public
Marysville Charter Academy For The Arts,Marysville,39.156494,-121.58831,95901,9,charter
Downtown Elementary School,Bakersfield,35.377361,-119.015877,93314,9,public
Tesoro High School,San Juan Capistrano,33.581936,-117.612541,92688,9,public
Rocklin Academy,Rocklin,38.802933,-121.28727,95765,9,charter
Nuview Bridge Early College High School,Nuevo,33.821533,-117.131142,92567,9,charter
Science Academy STEM Magnet,Los Angeles,34.170982,-118.371582,91601,10,public
California School Of The Arts - San Gabriel Valley,Duarte,34.136509,-117.968468,91010,10,charter
Oxford Academy,Anaheim,33.823738,-118.042343,90630,10,public
Troy High School,Fullerton,33.880791,-117.894325,92831,10,public
Fulton (Harry C.) Middle School,Fountain Valley,33.705379,-117.975922,92708,10,public
Ethan B. Allen Elementary School,Garden Grove,33.728195,-117.962418,92708,10,public
Hilton D. Bell Intermediate School,Garden Grove,33.783314,-118.02227,92845,10,public
Francis Hopkinson Elementary School,Los Alamitos,33.780449,-118.086884,90720,10,public
Richard Henry Lee Elementary School,Los Alamitos,33.796207,-118.082321,90720,10,public
Acalanes High School,Lafayette,37.903835,-122.09684,94549,10,public
John L. Golden Elementary School,Etiwanda,34.143864,-117.533623,91739,9,public
Grove School,Redlands,34.054096,-117.2174,92373,9,charter
Literacy First Charter School,San Diego,32.787121,-116.952011,92020,9,charter
Heritage Elementary School,Chula Vista,32.62645,-116.996651,91913,9,public
Scripps Elementary School,San Diego,32.930462,-117.082214,92131,9,public
The High School At Moorpark College,Moorpark,34.299614,-118.83419,93021,9,public
Riverview Elementary School,Clovis,36.880722,-119.737671,93730,9,public
Pantera Elementary School,Pomona,34.010876,-117.790977,91765,9,public
Los Osos High School,Ontario,34.145283,-117.555489,91737,9,public
Torrey Hills School,San Diego,32.914482,-117.223289,92130,9,public
Grossmont Middle College High School,El Cajon,32.816494,-117.006302,92020,9,public
Evergreen Valley High School,San Jose,37.322941,-121.778961,95148,9,public
Anderson New Technology High School,Anderson,40.452175,-122.300392,96007,9,charter
Connections Visual And Performing Arts Academy,Tuolumne,37.961437,-120.255325,95379,9,charter
Pico Canyon Elementary School,Valencia,34.381966,-118.578682,91381,9,public
Rio Norte Junior High School,Santa Clarita,34.460102,-118.558571,91354,9,public
High Tech La School,Lake Balboa,34.18726,-118.506195,91406,9,charter
Oak Meadow Elementary School,El Dorado Hills,38.664696,-121.058838,95762,9,public
KIPP Los Angeles College Preparatory School,Los Angeles,34.031239,-118.209442,90023,9,charter
Ladera Ranch Middle School,San Juan Capistrano,33.553646,-117.637245,92694,9,public
Oak Grove Elementary School,Visalia,36.348366,-119.340385,93291,9,public
Wilder's Preparatory Academy Charter,Inglewood,33.97438,-118.357292,90302,9,charter
Covington Elementary School,Los Altos,37.37149,-122.107071,94024,9,public
Sandra J. Gallardo Elementary School,Rancho Cordova,38.652916,-121.159897,95630,9,public
Middle College High School,Los Angeles,33.926613,-118.30838,90047,9,public
Scripps Ranch High School,San Diego,32.908188,-117.112503,92131,10,public
Carmel Creek Elementary School,Solana Beach,32.951405,-117.225449,92130,10,public
Solana Vista Elementary School,Solana Beach,33.003777,-117.250618,92075,10,public
Lowell High School,San Francisco,37.73069,-122.483078,94132,10,public
Las Lomitas Elementary School,Menlo Park,37.438381,-122.212563,94027,10,public
Oak Park High School,Oak Park,34.179718,-118.765709,91377,10,public
Edison Computech School,Fresno,36.716446,-119.804993,93706,10,public
Manchester Gate,Fresno,36.787823,-119.78241,93726,10,public
Francisco Bravo Medical Magnet High School,Los Angeles,34.05761,-118.203224,90089,10,public
Alameda High School,Alameda,37.76421,-122.24704,94501,9,public
Lincoln Middle School,Alameda,37.752831,-122.231895,94501,9,public
Jacoby Creek Charter School,Bayside,40.846588,-124.068336,95524,9,public
Warm Springs Elementary School,Fremont,37.482643,-121.923492,94539,9,public
L.A. County High School For The Arts,Downey,34.066326,-118.168457,90032,9,public
Richmond Street Elementary School,El Segundo,33.924351,-118.417458,90245,9,public
Santa Monica Alternative (K-8) School,Santa Monica,34.005222,-118.481171,90405,9,public
San Jose Charter Academy,West Covina,34.06237,-117.959679,91790,9,charter
Beechwood Elementary School,Fullerton,33.901161,-117.91497,92835,9,public
Huntington Seacliff Elementary School,Huntington Beach,33.687157,-118.011658,92648,9,public
Eastbluff Elementary School,Costa Mesa,33.64146,-117.880157,92660,9,public
Northwood High School,Irvine,33.729424,-117.751343,92620,9,public
Arroyo Vista Charter School,Chula Vista,32.638126,-116.952522,91915,9,charter
Mountain Valley Academy,Ramona,33.026249,-116.877533,92065,9,public
Mt. Everest Academy,San Diego,32.819874,-117.186485,92117,9,public
Middle College High School,Santa Ana,33.758472,-117.885948,92706,10,public
Carmel Valley Middle School,Encinitas,32.947182,-117.231247,92130,10,public
Pacific Collegiate Charter School,Santa Cruz,36.960552,-122.059776,95060,10,charter
Academy Of The Canyons,Santa Clarita,34.404381,-118.570587,91355,10,public
Ocsa,Santa Ana,33.754066,-117.867599,92701,10,charter
Middle College High School,Lodi,37.995083,-121.31929,95207,10,public
Redwood Academy Of Ukiah,Ukiah,39.164875,-123.210159,95482,10,charter
West Campus,Sacramento,38.529457,-121.44017,95820,10,public
Grapeland Elementary School,Etiwanda,34.12365,-117.522842,91739,10,public
Westview High School,San Diego,32.967026,-117.148354,92129,10,public
Technology High School,Rohnert Park,38.340935,-122.67382,94928,10,public
La Mariposa School,Camarillo,34.234524,-119.007484,93012,10,public
Aspire Benjamin Holt College Preparatory Academy,Lodi,38.037048,-121.274437,95212,10,charter
Hawthorne Math And Science Academy,Hawthorne,33.920345,-118.354141,90250,10,charter
Harbor Teacher Preparation Academy,Los Angeles,33.784309,-118.281837,90744,10,public
Design Science Early College High School,Fresno,36.766922,-119.797905,93704,10,public
Alameda Science And Technology Institute,Alameda,37.780872,-122.279305,94501,10,public
Cerritos High School,Cerritos,33.865402,-118.064575,90703,10,public
Whitney High School,Cerritos,33.878098,-118.054283,90703,10,public
Canyon Crest Academy,Encinitas,32.959076,-117.18943,92130,10,public
West Ranch High School,Santa Clarita,34.403206,-118.596558,91381,10,public
Great Oak High School,Temecula,33.451641,-117.091911,92592,10,public
University Preparatory School,Victorville,34.513405,-117.36087,92392,10,public
International Polytechnic High School,Downey,34.055599,-117.81926,91768,10,public
Natomas Pacific Pathways Prep School,Sacramento,38.655201,-121.546059,95834,10,charter
Preuss School Ucsd,San Diego,32.875469,-117.23912,92093,9,charter
Welby Way Elementary Charter School,Los Angeles,34.19154,-118.638237,91307,9,charter
Westwood Charter Elementary School,Los Angeles,34.047756,-118.430527,90025,9,charter
Wonderland Avenue Elementary School,Los Angeles,34.114044,-118.380028,90046,9,public
Woodland Hills Elementary Charter For Enriched Studies,Los Angeles,34.159027,-118.610474,91364,9,charter
Meadows Arts And Technology Elementary School,Camarillo,34.193333,-118.84127,91362,9,charter
Chinese Immersion School At Deavila,San Francisco,37.769871,-122.444336,94117,9,public
Da Vinci Charter Academy,Davis,38.552822,-121.733353,95616,9,charter
La Canada Elementary School,La Canada,34.208569,-118.205803,91011,9,public
Palm Crest Elementary School,La Canada,34.222172,-118.218491,91011,9,public
Paradise Canyon Elementary School,La Canada,34.208759,-118.187737,91011,9,public
Stevenson Elementary School,Mountain View,37.403496,-122.083923,94043,9,public
Western Sierra Collegiate Academy,Rocklin,38.812359,-121.298218,95765,9,charter
Cornerstone Academy Preparatory School,San Jose,37.32563,-121.853027,95122,9,charter
Puc Lakeview Charter High School,Burbank,34.314739,-118.459557,91342,9,charter
Sierra Expeditionary Learning School,Truckee,39.324657,-120.208984,96161,9,charter
Accelerated Achievement Academy,Hollister,36.85651,-121.417313,95023,9,public
Inspire School of Arts and Sciences,Chico,39.734634,-121.848114,95926,9,charter
"Math, Science, & Technology Magnet Academy At Roosevelt High",Los Angeles,34.037521,-118.212006,90033,9,public
West Creek Academy,Santa Clarita,34.458256,-118.568787,91354,9,public
Fremont Elementary School,Long Beach,33.771191,-118.144592,90814,9,public
Gilroy Prep School,Gilroy,37.015465,-121.568069,95020,9,charter
Pacific Law Academy,Stockton,37.983559,-121.323425,95207,9,charter
Oxford Preparatory Academy - South Orange County,Mission Viejo,33.629208,-117.658424,92691,9,charter
Hidden Valley Elementary,San Anselmo,38.005577,-122.573685,94960,9,public
The Academy for Enriched Sciences,Los Angeles,34.17514,-118.515305,91316,9,public
Harold William Kolb,Dublin,37.712048,-121.858841,94568,9,public
Mission Preparatory School,San Francisco,37.75544,-122.408569,94110,9,charter
Lowell Elementary School,Long Beach,33.765377,-118.132202,90803,9,public
Newcomb Academy,Long Beach,33.816231,-118.080055,90808,9,public
Prisk Elementary School,Long Beach,33.802063,-118.116951,90815,9,public
Tincher Preparatory School,Long Beach,33.787983,-118.100838,90815,9,public
El Portal Elementary School,Whittier,33.933193,-117.965538,90631,9,public
Meadow Green Elementary School,Whittier,33.922047,-117.988831,90604,9,public
Willow Elementary School,Calabasas,34.158623,-118.757835,91301,9,public
Yu Ming Charter School,Hayward,37.847374,-122.283562,94608,9,charter
Grand View Elementary School,Manhattan Beach,33.894386,-118.412613,90266,9,public
Manhattan Beach Middle School,Manhattan Beach,33.889107,-118.383873,90266,9,public
Mira Costa High School,Manhattan Beach,33.873657,-118.389793,90266,9,public
Pacific Elementary School,Manhattan Beach,33.889008,-118.402512,90266,9,public
Aurelia Pennekamp Elementary School,Manhattan Beach,33.879444,-118.388245,90266,9,public
Opal Robinson Elementary School,Manhattan Beach,33.878021,-118.403671,90266,9,public
Reedley Middle College High,Reedley,36.605392,-119.460007,93654,9,charter
Porter Ranch Community School,Los Angeles,34.293591,-118.581764,91326,9,public
Meadows Elementary School,Valencia,34.391453,-118.554878,91355,9,public
Riverside Stem Academy,Riverside,33.968815,-117.313217,92507,9,public
Stevenson Ranch Elementary School,Valencia,34.390938,-118.595985,91381,9,public
Valencia Valley Elementary School,Valencia,34.408504,-118.547226,91355,9,public
Public Safety Academy,Fairfield,38.276814,-122.037834,94533,9,public
Gardenhill Elementary School,Norwalk,33.911842,-118.02227,90638,9,public
Ernest S. McBride Sr. High School,Long Beach,33.830803,-118.098045,90808,9,public
Delevan Drive Elementary School,Los Angeles,34.127544,-118.227219,90065,9,public
Fairburn Avenue Elementary School,Los Angeles,34.059158,-118.431145,90024,9,public
Robert Frost Middle School,Los Angeles,34.294872,-118.511635,91344,9,public
Cornell Elementary School,Berkeley,37.889767,-122.29538,94706,9,public
Granada Hills Charter High School,Granada Hills,34.260891,-118.525368,91344,9,charter
Ivanhoe Elementary School,Los Angeles,34.108788,-118.266899,90039,9,public
Hillcrest Elementary School,Oakland,37.840755,-122.23246,94618,9,public
Kenter Canyon Elementary School,Los Angeles,34.070724,-118.48909,90049,9,charter
Kester Avenue Elementary School,Los Angeles,34.167732,-118.45858,91411,9,public
King/Drew Medical Magnet High School,Los Angeles,33.924122,-118.245811,90059,9,public
Mayall Street Elementary School,Los Angeles,34.254425,-118.496361,91343,9,public
Melrose Elementary School,Los Angeles,34.084255,-118.345421,90046,9,public
Open Charter Magnet School,Los Angeles,33.968163,-118.378288,90045,9,charter
Overland Avenue Elementary School,Los Angeles,34.038216,-118.421303,90064,9,public
Park Western Place Elementary School,Los Angeles,33.753315,-118.304039,90732,9,public
Roscomare Road Elementary School,Los Angeles,34.120098,-118.464996,90077,9,public
Taper Avenue Elementary School,Los Angeles,33.76218,-118.298347,90731,9,public
Ocean Air School,San Diego,32.928009,-117.214859,92130,9,public
Vista Del Lago High School,Rancho Cordova,38.655964,-121.108009,95630,9,public
KIPP King Collegiate High School,San Lorenzo,37.674419,-122.150391,94580,9,charter
University Preparatory Academy Charter,San Jose,37.292255,-121.873917,95125,9,charter
Monterey Vista Elementary School,Rosemead,34.055653,-118.109665,91755,9,public
John Green Elementary School,Dublin,37.71841,-121.862442,94568,9,public
Russell Ranch Elementary School,Rancho Cordova,38.651554,-121.089912,95630,9,public
Camarillo Academy of Progressive Education,Oxnard,34.225822,-119.059319,93010,9,charter
Global Education Academy,Los Angeles,34.008354,-118.283127,90037,9,charter
Glendora High School,Glendora,34.1343,-117.835487,91741,9,public
Live Oak Elementary School,Danville,37.754025,-121.894768,94582,9,public
Crescenta Valley High School,Glendale,34.223152,-118.243362,91214,9,public
Horace Mann Elementary School,Glendale,34.135479,-118.248962,91205,9,public
Monte Vista Elementary School,Glendale,34.23037,-118.235977,91214,9,public
Mountain Avenue Elementary School,Glendale,34.224792,-118.228226,91214,9,public
Rosemont Middle School,Glendale,34.226204,-118.236282,91214,9,public
Vintage Math/Science/Technology Magnet School,Los Angeles,34.252079,-118.477592,91343,9,public
Del Sur Elementary School,San Diego,33.018543,-117.140541,92127,9,public
Harmony Magnet Academy,Porterville,36.14323,-119.064316,93267,9,charter
Willow Grove Elementary School,San Diego,32.99263,-117.161293,92127,9,public
West Hollywood Elementary School,Los Angeles,34.089127,-118.387337,90069,9,public
Wilder's Preparatory Academy Charter Middle,Inglewood,33.97438,-118.357292,90302,9,charter
KIPP San Jose Collegiate,San Jose,37.368244,-121.860077,95133,9,charter
Warner Avenue Elementary School,Los Angeles,34.069641,-118.433334,90024,9,public
Grazide Elementary School,City of Industry,33.983273,-117.961761,91745,9,public
Los Molinos Elementary School,City of Industry,33.982788,-117.977982,91745,9,public
Wedgeworth Elementary School,City of Industry,33.996445,-117.936661,91745,9,public
Albany High School,Berkeley,37.896305,-122.291885,94706,9,public
Canyon Elementary School,Los Angeles,34.031696,-118.512177,90402,9,charter
Crocker Highlands Elementary School,Oakland,37.811066,-122.227234,94610,9,public
Albany Middle School,Berkeley,37.898098,-122.294853,94706,9,public
Community Magnet Charter Elementary School,Los Angeles,34.082741,-118.463333,90049,9,charter
Cowan Avenue Elementary School,Los Angeles,33.97266,-118.405403,90045,9,public
Foothills Middle School,Arcadia,34.153339,-118.025833,91006,9,public
Holly Avenue Elementary School,Arcadia,34.126495,-118.045319,91007,9,public
Longley Way Elementary School,Arcadia,34.109146,-118.041801,91007,9,public
Day Creek Intermediate School,Etiwanda,34.154259,-117.53389,91739,9,public
Arnold Adreani Elementary School,Elk Grove,38.470711,-121.324142,95829,9,public
Pleasant Grove High School,Elk Grove,38.426231,-121.339149,95624,9,public
Alamos Elementary School,Temecula,33.563614,-117.110664,92563,9,public
Gardner Bullis Elementary School,Los Altos,37.381752,-122.130486,94022,9,public
Beverly Hills High School,Beverly Hills,34.061535,-118.410378,90212,9,public
Bonita High School,San Dimas,34.108669,-117.764458,91750,9,public
Oak Mesa Elementary School,San Dimas,34.128624,-117.775291,91750,9,public
J. Marion Roynon Elementary School,San Dimas,34.103584,-117.767776,91750,9,public
Arma J. Shull Elementary School,San Dimas,34.116798,-117.821037,91773,9,public
Theodore Roosevelt Elementary School,Burbank,34.166374,-118.344551,91505,9,public
Claremont High School,Claremont,34.113007,-117.722542,91711,9,public
El Marino Elementary School,Culver City,33.992115,-118.400429,90230,9,public
Farragut Elementary School,Culver City,34.006996,-118.399147,90230,9,public
Eleanor Roosevelt High School,Norco,33.955082,-117.568665,92880,9,public
Alliance Dr. Olga Mohan High School,Los Angeles,34.036926,-118.272263,90015,9,charter
Alliance Marc & Eva Stern Math And Science,Los Angeles,34.066326,-118.168457,90032,9,charter
Early College High School,Costa Mesa,33.680565,-117.928192,92626,9,public
Arroyo Vista Middle School,San Juan Capistrano,33.623207,-117.615433,92688,9,public
John F. Kennedy High School,Norco,33.917046,-117.564537,92860,9,public
Center Street Elementary,El Segundo,33.924732,-118.40461,90245,9,public
Classical Academy High School,Escondido,33.124187,-117.080566,92025,9,charter
KIPP Promesa Prep,Los Angeles,34.037598,-118.201836,90033,9,charter
Jonas Salk Elementary School,San Diego,32.906593,-117.15699,92126,9,public
John Mccandless Charter,Stockton,37.988518,-121.316032,95207,9,charter
Rancho Campana High,Oxnard,34.244862,-119.013374,93010,9,public
Hoover Elementary,Burlingame,37.576172,-122.380188,94010,9,public
Carmel High School,Carmel,36.555305,-121.909538,93923,9,public
Double Peak K-8,San Marcos,33.10638,-117.165825,92078,9,public
Carmel River Elementary School,Carmel,36.542519,-121.924255,93923,9,public
